{
  "schema_version": 1,
  "authority": "../docs/spec/ui-foundation.md",
  "qualification": "Required target inventory; presence does not imply implementation or passing tests.",
  "components": [
    {
      "id": "C001",
      "name": "AppTheme",
      "module": ":ui:design-system",
      "contract": "Resolve typed appearance and metrics for descendants with reactive system mode and explicit overrides.",
      "verification": "Change system mode, apply override, corrupt saved preference and verify mode/contrast precedence.",
      "owner_slice": "BDS-03.03",
      "requirements": [
        "BUI-05",
        "BUI-11"
      ],
      "evidence_required": [
        "implementation",
        "usage_example",
        "applicable_states",
        "accessibility_semantics",
        "behavior_tests",
        "android_ios_evidence"
      ]
    },
    {
      "id": "C002",
      "name": "AppSurface",
      "module": ":ui:design-system",
      "contract": "Apply semantic background, content color, shape and optional interaction without owning data.",
      "verification": "Verify inherited content color, clipping, enabled interaction and opaque readability.",
      "owner_slice": "BDS-04.01",
      "requirements": [
        "BUI-05",
        "BUI-11"
      ],
      "evidence_required": [
        "implementation",
        "usage_example",
        "applicable_states",
        "accessibility_semantics",
        "behavior_tests",
        "android_ios_evidence"
      ]
    },
    {
      "id": "C003",
      "name": "AppCard",
      "module": ":ui:design-system",
      "contract": "Group caller content with semantic container variants and optional action.",
      "verification": "Exercise long content, selectable versus passive semantics and disabled click suppression.",
      "owner_slice": "BDS-04.01",
      "requirements": [
        "BUI-05",
        "BUI-11"
      ],
      "evidence_required": [
        "implementation",
        "usage_example",
        "applicable_states",
        "accessibility_semantics",
        "behavior_tests",
        "android_ios_evidence"
      ]
    },
    {
      "id": "C004",
      "name": "AppDivider",
      "module": ":ui:design-system",
      "contract": "Separate content with tokenized thickness and orientation.",
      "verification": "Check bounds, contrast variants and absence of redundant accessibility announcements.",
      "owner_slice": "BDS-04.01",
      "requirements": [
        "BUI-05",
        "BUI-11"
      ],
      "evidence_required": [
        "implementation",
        "usage_example",
        "applicable_states",
        "accessibility_semantics",
        "behavior_tests",
        "android_ios_evidence"
      ]
    },
    {
      "id": "C005",
      "name": "AppScrim",
      "module": ":ui:design-system",
      "contract": "Dim underlying content and expose only the caller-approved dismissal action.",
      "verification": "Verify layering, hit interception, disabled dismissal and accessibility focus exclusion.",
      "owner_slice": "BDS-04.01",
      "requirements": [
        "BUI-05",
        "BUI-11"
      ],
      "evidence_required": [
        "implementation",
        "usage_example",
        "applicable_states",
        "accessibility_semantics",
        "behavior_tests",
        "android_ios_evidence"
      ]
    },
    {
      "id": "C006",
      "name": "AppText",
      "module": ":ui:design-system",
      "contract": "Render shared typography with caller text, overflow and semantic configuration.",
      "verification": "Check font scale, multiline overflow, RTL and exact bundled font selection.",
      "owner_slice": "BDS-04.02",
      "requirements": [
        "BUI-05",
        "BUI-11"
      ],
      "evidence_required": [
        "implementation",
        "usage_example",
        "applicable_states",
        "accessibility_semantics",
        "behavior_tests",
        "android_ios_evidence"
      ]
    },
    {
      "id": "C007",
      "name": "AppLabel",
      "module": ":ui:design-system",
      "contract": "Provide reusable control labels with explicit association and emphasis.",
      "verification": "Verify required/disabled indication and one associated accessible label.",
      "owner_slice": "BDS-04.02",
      "requirements": [
        "BUI-05",
        "BUI-11"
      ],
      "evidence_required": [
        "implementation",
        "usage_example",
        "applicable_states",
        "accessibility_semantics",
        "behavior_tests",
        "android_ios_evidence"
      ]
    },
    {
      "id": "C008",
      "name": "AppIcon",
      "module": ":ui:design-system",
      "contract": "Render shared vector assets with explicit meaningful or decorative semantics.",
      "verification": "Test tint, sizing, directional mirroring and omitted decorative descriptions.",
      "owner_slice": "BDS-04.02",
      "requirements": [
        "BUI-05",
        "BUI-11"
      ],
      "evidence_required": [
        "implementation",
        "usage_example",
        "applicable_states",
        "accessibility_semantics",
        "behavior_tests",
        "android_ios_evidence"
      ]
    },
    {
      "id": "C009",
      "name": "AppImage",
      "module": ":ui:design-system",
      "contract": "Display an already available image with controlled size, scale and description.",
      "verification": "Test aspect ratio, clipping, missing content and meaningful versus decorative semantics.",
      "owner_slice": "BDS-04.03",
      "requirements": [
        "BUI-05",
        "BUI-11"
      ],
      "evidence_required": [
        "implementation",
        "usage_example",
        "applicable_states",
        "accessibility_semantics",
        "behavior_tests",
        "android_ios_evidence"
      ]
    },
    {
      "id": "C010",
      "name": "AppAvatar",
      "module": ":ui:design-system",
      "contract": "Present person-neutral image or initials fallback in a consistent shape.",
      "verification": "Test missing image, empty/long initials, clipping and readable fallback.",
      "owner_slice": "BDS-04.03",
      "requirements": [
        "BUI-05",
        "BUI-11"
      ],
      "evidence_required": [
        "implementation",
        "usage_example",
        "applicable_states",
        "accessibility_semantics",
        "behavior_tests",
        "android_ios_evidence"
      ]
    },
    {
      "id": "C011",
      "name": "AppBadge",
      "module": ":ui:design-system",
      "contract": "Show bounded count or status without replacing the associated control label.",
      "verification": "Test zero/overflow counts, text scaling and nonduplicated announcements.",
      "owner_slice": "BDS-04.03",
      "requirements": [
        "BUI-05",
        "BUI-11"
      ],
      "evidence_required": [
        "implementation",
        "usage_example",
        "applicable_states",
        "accessibility_semantics",
        "behavior_tests",
        "android_ios_evidence"
      ]
    },
    {
      "id": "C012",
      "name": "AppTopAppBar",
      "module": ":ui:design-system",
      "contract": "Arrange title and caller-owned leading/trailing actions with shared appearance.",
      "verification": "Test long title, target sizes, insets and action reading order.",
      "owner_slice": "BDS-05.02",
      "requirements": [
        "BUI-05",
        "BUI-11"
      ],
      "evidence_required": [
        "implementation",
        "usage_example",
        "applicable_states",
        "accessibility_semantics",
        "behavior_tests",
        "android_ios_evidence"
      ]
    },
    {
      "id": "C013",
      "name": "AppToolbar",
      "module": ":ui:design-system",
      "contract": "Arrange contextual caller actions without owning their workflow.",
      "verification": "Test overflow, disabled actions, RTL order and keyboard focus.",
      "owner_slice": "BDS-05.02",
      "requirements": [
        "BUI-05",
        "BUI-11"
      ],
      "evidence_required": [
        "implementation",
        "usage_example",
        "applicable_states",
        "accessibility_semantics",
        "behavior_tests",
        "android_ios_evidence"
      ]
    },
    {
      "id": "C014",
      "name": "AppBottomActionBar",
      "module": ":ui:design-system",
      "contract": "Lay out bottom actions above owned safe-area/keyboard bounds.",
      "verification": "Test keyboard appearance, long labels and one application of bottom insets.",
      "owner_slice": "BDS-05.02",
      "requirements": [
        "BUI-05",
        "BUI-11"
      ],
      "evidence_required": [
        "implementation",
        "usage_example",
        "applicable_states",
        "accessibility_semantics",
        "behavior_tests",
        "android_ios_evidence"
      ]
    },
    {
      "id": "C015",
      "name": "AppTabBar",
      "module": ":ui:design-system",
      "contract": "Expose top-level selection through values and callbacks.",
      "verification": "Test selection semantics, repeated selection and no private navigation stack.",
      "owner_slice": "BDS-05.02",
      "requirements": [
        "BUI-05",
        "BUI-11"
      ],
      "evidence_required": [
        "implementation",
        "usage_example",
        "applicable_states",
        "accessibility_semantics",
        "behavior_tests",
        "android_ios_evidence"
      ]
    },
    {
      "id": "C016",
      "name": "AppTabBarItem",
      "module": ":ui:design-system",
      "contract": "Render an accessible destination item with icon, label and optional badge.",
      "verification": "Test selected/disabled state, long label and minimum interaction target.",
      "owner_slice": "BDS-05.02",
      "requirements": [
        "BUI-05",
        "BUI-11"
      ],
      "evidence_required": [
        "implementation",
        "usage_example",
        "applicable_states",
        "accessibility_semantics",
        "behavior_tests",
        "android_ios_evidence"
      ]
    },
    {
      "id": "C017",
      "name": "AppTabRow",